,Month,Airport,Number of Delays,Total Flights,Percent Delayed,Airport Name,Delay Category
2026,6,VLD,12,86,0.139534884,"Valdosta, GA: Valdosta Regional",>8.3% and <23.3%
2027,6,VPS,215,849,0.253239105,"Valparaiso, FL: Eglin AFB Destin Fort Walton Beach",>23.3% and <30.8%
2028,6,WRG,8,60,0.133333333,"Wrangell, AK: Wrangell Airport",>8.3% and <23.3%
2029,6,WYS,3,52,0.057692308,"West Yellowstone, MT: Yellowstone",>0.8% and <8.3%
2030,6,XNA,234,1122,0.20855615,"Fayetteville, AR: Northwest Arkansas Regional",>8.3% and <23.3%
2031,6,YAK,5,60,0.083333333,"Yakutat, AK: Yakutat Airport",>8.3% and <23.3%
2032,6,YUM,2,115,0.017391304,"Yuma, AZ: Yuma MCAS/Yuma International",>0.8% and <8.3%
2033,7,ABE,70,337,0.207715134,"Allentown/Bethlehem/Easton, PA: Lehigh Valley International",>8.3% and <23.3%
2034,7,ABI,42,174,0.24137931,"Abilene, TX: Abilene Regional",>23.3% and <30.8%
2035,7,ABQ,444,2256,0.196808511,"Albuquerque, NM: Albuquerque International Sunport",>8.3% and <23.3%
2036,7,ABR,9,61,0.147540984,"Aberdeen, SD: Aberdeen Regional",>8.3% and <23.3%
2037,7,ABY,14,89,0.157303371,"Albany, GA: Southwest Georgia Regional",>8.3% and <23.3%
2038,7,ACK,83,297,0.279461279,"Nantucket, MA: Nantucket Memorial",>23.3% and <30.8%
2039,7,ACT,27,146,0.184931507,"Waco, TX: Waco Regional",>8.3% and <23.3%
2040,7,ACV,24,150,0.16,"Arcata/Eureka, CA: California Redwood Coast Humboldt County",>8.3% and <23.3%
2041,7,ACY,42,264,0.159090909,"Atlantic City, NJ: Atlantic City International",>8.3% and <23.3%
2042,7,ADK,3,8,0.375,"Adak Island, AK: Adak",>30.8%
2043,7,ADQ,8,58,0.137931034,"Kodiak, AK: Kodiak Airport",>8.3% and <23.3%
2044,7,AEX,35,286,0.122377622,"Alexandria, LA: Alexandria International",>8.3% and <23.3%
2045,7,AGS,69,381,0.181102362,"Augusta, GA: Augusta Regional at Bush Field",>8.3% and <23.3%
2046,7,AKN,10,31,0.322580645,"King Salmon, AK: King Salmon Airport",>30.8%
2047,7,ALB,207,1027,0.201557936,"Albany, NY: Albany International",>8.3% and <23.3%
2048,7,ALO,13,56,0.232142857,"Waterloo, IA: Waterloo Regional",>8.3% and <23.3%
2049,7,AMA,81,474,0.170886076,"Amarillo, TX: Rick Husband Amarillo International",>8.3% and <23.3%
2050,7,ANC,203,2243,0.09050379,"Anchorage, AK: Ted Stevens Anchorage International",>8.3% and <23.3%
2051,7,APN,8,51,0.156862745,"Alpena, MI: Alpena County Regional",>8.3% and <23.3%
2052,7,ASE,108,567,0.19047619,"Aspen, CO: Aspen Pitkin County Sardy Field",>8.3% and <23.3%
2053,7,ATL,7734,34745,0.222593179,"Atlanta, GA: Hartsfield-Jackson Atlanta International",>8.3% and <23.3%
2054,7,ATW,56,377,0.148541114,"Appleton, WI: Appleton International",>8.3% and <23.3%
2055,7,AUS,1169,5820,0.200859107,"Austin, TX: Austin - Bergstrom International",>8.3% and <23.3%
2056,7,AVL,137,758,0.180738786,"Asheville, NC: Asheville Regional",>8.3% and <23.3%
2057,7,AVP,44,289,0.152249135,"Scranton/Wilkes-Barre, PA: Wilkes Barre Scranton International",>8.3% and <23.3%
2058,7,AZA,105,462,0.227272727,"Phoenix, AZ: Phoenix - Mesa Gateway",>8.3% and <23.3%
2059,7,AZO,30,272,0.110294118,"Kalamazoo, MI: Kalamazoo/Battle Creek International",>8.3% and <23.3%
2060,7,BDL,482,2398,0.201000834,"Hartford, CT: Bradley International",>8.3% and <23.3%
2061,7,BET,2,70,0.028571429,"Bethel, AK: Bethel Airport",>0.8% and <8.3%
2062,7,BFF,7,52,0.134615385,"Scottsbluff, NE: Western Neb. Regional/William B. Heilig Field",>8.3% and <23.3%
2063,7,BFL,15,208,0.072115385,"Bakersfield, CA: Meadows Field",>0.8% and <8.3%
2064,7,BGM,11,71,0.154929577,"Binghamton, NY: Greater Binghamton/Edwin A. Link Field",>8.3% and <23.3%
2065,7,BGR,106,452,0.234513274,"Bangor, ME: Bangor International",>23.3% and <30.8%
2066,7,BHM,358,1619,0.221124151,"Birmingham, AL: Birmingham-Shuttlesworth International",>8.3% and <23.3%
2067,7,BIL,57,492,0.115853659,"Billings, MT: Billings Logan International",>8.3% and <23.3%
2068,7,BIS,63,352,0.178977273,"Bismarck/Mandan, ND: Bismarck Municipal",>8.3% and <23.3%
2069,7,BJI,8,68,0.117647059,"Bemidji, MN: Bemidji Regional",>8.3% and <23.3%
2070,7,BKG,6,13,0.461538462,"Branson, MO: Branson Airport",>30.8%
2071,7,BLI,11,149,0.073825503,"Bellingham, WA: Bellingham International",>0.8% and <8.3%
2072,7,BLV,54,136,0.397058824,"Belleville, IL: Scott AFB/MidAmerica",>30.8%
2073,7,BMI,35,268,0.130597015,"Bloomington/Normal, IL: Central Il Regional Airport at Bloomington",>8.3% and <23.3%
2074,7,BNA,1583,6491,0.243876136,"Nashville, TN: Nashville International",>23.3% and <30.8%
2075,7,BOI,223,1722,0.129500581,"Boise, ID: Boise Air Terminal",>8.3% and <23.3%
2076,7,BOS,3115,13218,0.235663489,"Boston, MA: Logan International",>23.3% and <30.8%
2077,7,BPT,9,79,0.113924051,"Beaumont/Port Arthur, TX: Jack Brooks Regional",>8.3% and <23.3%
2078,7,BQK,11,92,0.119565217,"Brunswick, GA: Brunswick Golden Isles",>8.3% and <23.3%
2079,7,BQN,77,217,0.35483871,"Aguadilla, PR: Rafael Hernandez",>30.8%
2080,7,BRD,6,61,0.098360656,"Brainerd, MN: Brainerd Lakes Regional",>8.3% and <23.3%
2081,7,BRO,47,233,0.201716738,"Brownsville, TX: Brownsville South Padre Island International",>8.3% and <23.3%
2082,7,BRW,2,62,0.032258065,"Barrow, AK: Wiley Post/Will Rogers Memorial",>0.8% and <8.3%
2083,7,BTM,4,57,0.070175439,"Butte, MT: Bert Mooney",>0.8% and <8.3%
2084,7,BTR,110,673,0.163447251,"Baton Rouge, LA: Baton Rouge Metropolitan/Ryan Field",>8.3% and <23.3%
2085,7,BTV,161,941,0.17109458,"Burlington, VT: Burlington International",>8.3% and <23.3%
2086,7,BUF,450,2325,0.193548387,"Buffalo, NY: Buffalo Niagara International",>8.3% and <23.3%
2087,7,BUR,452,2244,0.201426025,"Burbank, CA: Bob Hope",>8.3% and <23.3%
2088,7,BWI,2941,9721,0.302540891,"Baltimore, MD: Baltimore/Washington International Thurgood Marshall",>23.3% and <30.8%
2089,7,BZN,104,668,0.155688623,"Bozeman, MT: Bozeman Yellowstone International",>8.3% and <23.3%
2090,7,CAE,108,597,0.180904523,"Columbia, SC: Columbia Metropolitan",>8.3% and <23.3%
2091,7,CAK,121,651,0.185867896,"Akron, OH: Akron-Canton Regional",>8.3% and <23.3%
2092,7,CDC,6,52,0.115384615,"Cedar City, UT: Cedar City Regional",>8.3% and <23.3%
2093,7,CDV,4,62,0.064516129,"Cordova, AK: Merle K Mudhole Smith",>0.8% and <8.3%
2094,7,CGI,8,52,0.153846154,"Cape Girardeau, MO: Cape Girardeau Regional",>8.3% and <23.3%
2095,7,CHA,164,815,0.201226994,"Chattanooga, TN: Lovell Field",>8.3% and <23.3%
2096,7,CHO,97,467,0.207708779,"Charlottesville, VA: Charlottesville Albemarle",>8.3% and <23.3%
2097,7,CHS,465,2302,0.201998262,"Charleston, SC: Charleston AFB/International",>8.3% and <23.3%
2098,7,CID,129,793,0.162673392,"Cedar Rapids/Iowa City, IA: The Eastern Iowa",>8.3% and <23.3%
2099,7,CIU,1,57,0.01754386,"Sault Ste. Marie, MI: Chippewa County International",>0.8% and <8.3%
2100,7,CKB,21,76,0.276315789,"Clarksburg/Fairmont, WV: North Central West Virginia",>23.3% and <30.8%
2101,7,CLE,737,4263,0.172882946,"Cleveland, OH: Cleveland-Hopkins International",>8.3% and <23.3%
2102,7,CLL,35,202,0.173267327,"College Station/Bryan, TX: Easterwood Field",>8.3% and <23.3%
2103,7,CLT,5239,20423,0.256524507,"Charlotte, NC: Charlotte Douglas International",>23.3% and <30.8%
2104,7,CMH,835,4083,0.20450649,"Columbus, OH: John Glenn Columbus International",>8.3% and <23.3%
2105,7,CMI,27,206,0.131067961,"Champaign/Urbana, IL: University of Illinois/Willard",>8.3% and <23.3%
2106,7,CMX,7,61,0.114754098,"Hancock/Houghton, MI: Houghton County Memorial",>8.3% and <23.3%
2107,7,CNY,6,53,0.113207547,"Moab, UT: Canyonlands Field",>8.3% and <23.3%
2108,7,COD,4,39,0.102564103,"Cody, WY: Yellowstone Regional",>8.3% and <23.3%
2109,7,COS,217,1005,0.215920398,"Colorado Springs, CO: City of Colorado Springs Municipal",>8.3% and <23.3%
2110,7,COU,37,175,0.211428571,"Columbia, MO: Columbia Regional",>8.3% and <23.3%
2111,7,CPR,4,109,0.036697248,"Casper, WY: Casper/Natrona County International",>0.8% and <8.3%
2112,7,CRP,77,465,0.165591398,"Corpus Christi, TX: Corpus Christi International",>8.3% and <23.3%
2113,7,CRW,69,392,0.176020408,"Charleston/Dunbar, WV: Yeager",>8.3% and <23.3%
2114,7,CSG,19,113,0.168141593,"Columbus, GA: Columbus Airport",>8.3% and <23.3%
2115,7,CVG,978,4482,0.218206158,"Cincinnati, OH: Cincinnati/Northern Kentucky International",>8.3% and <23.3%
2116,7,CWA,34,252,0.134920635,"Mosinee, WI: Central Wisconsin",>8.3% and <23.3%
2117,7,DAB,71,318,0.22327044,"Daytona Beach, FL: Daytona Beach International",>8.3% and <23.3%
2118,7,DAL,1946,6070,0.320593081,"Dallas, TX: Dallas Love Field",>30.8%
2119,7,DAY,215,1213,0.177246496,"Dayton, OH: James M Cox/Dayton International",>8.3% and <23.3%
2120,7,DBQ,15,86,0.174418605,"Dubuque, IA: Dubuque Regional",>8.3% and <23.3%
2121,7,DCA,2184,11052,0.197611292,"Washington, DC: Ronald Reagan Washington National",>8.3% and <23.3%
2122,7,DEN,5201,22146,0.234850537,"Denver, CO: Denver International",>23.3% and <30.8%
2123,7,DFW,6778,25228,0.268669732,"Dallas/Fort Worth, TX: Dallas/Fort Worth International",>23.3% and <30.8%
2124,7,DHN,18,114,0.157894737,"Dothan, AL: Dothan Regional",>8.3% and <23.3%
2125,7,DLG,4,31,0.129032258,"Dillingham, AK: Dillingham Airport",>8.3% and <23.3%
2126,7,DLH,37,256,0.14453125,"Duluth, MN: Duluth International",>8.3% and <23.3%
2127,7,DRO,71,299,0.237458194,"Durango, CO: Durango La Plata County",>23.3% and <30.8%
2128,7,DSM,200,1297,0.154202005,"Des Moines, IA: Des Moines International",>8.3% and <23.3%
2129,7,DTW,2300,13723,0.167601836,"Detroit, MI: Detroit Metro Wayne County",>8.3% and <23.3%
2130,7,DVL,6,52,0.115384615,"Devils Lake, ND: Devils Lake Regional",>8.3% and <23.3%
2131,7,EAU,10,61,0.163934426,"Eau Claire, WI: Chippewa Valley Regional",>8.3% and <23.3%
2132,7,ECP,112,611,0.183306056,"Panama City, FL: Northwest Florida Beaches International",>8.3% and <23.3%
2133,7,EGE,11,83,0.13253012,"Eagle, CO: Eagle County Regional",>8.3% and <23.3%
2134,7,EKO,1,45,0.022222222,"Elko, NV: Elko Regional",>0.8% and <8.3%
2135,7,ELM,1,25,0.04,"Elmira/Corning, NY: Elmira/Corning Regional",>0.8% and <8.3%
2136,7,ELP,328,1488,0.220430108,"El Paso, TX: El Paso International",>8.3% and <23.3%
2137,7,ERI,4,75,0.053333333,"Erie, PA: Erie International/Tom Ridge Field",>0.8% and <8.3%
2138,7,ESC,3,52,0.057692308,"Escanaba, MI: Delta County",>0.8% and <8.3%
2139,7,EUG,64,385,0.166233766,"Eugene, OR: Mahlon Sweet Field",>8.3% and <23.3%
2140,7,EVV,77,424,0.181603774,"Evansville, IN: Evansville Regional",>8.3% and <23.3%
2141,7,EWN,30,207,0.144927536,"New Bern/Morehead/Beaufort, NC: Coastal Carolina Regional",>8.3% and <23.3%
2142,7,EWR,3630,12657,0.286797819,"Newark, NJ: Newark Liberty International",>23.3% and <30.8%
2143,7,EYW,48,314,0.152866242,"Key West, FL: Key West International",>8.3% and <23.3%
2144,7,FAI,42,477,0.088050314,"Fairbanks, AK: Fairbanks International",>8.3% and <23.3%
2145,7,FAR,81,475,0.170526316,"Fargo, ND: Hector International",>8.3% and <23.3%
2146,7,FAT,176,1035,0.170048309,"Fresno, CA: Fresno Yosemite International",>8.3% and <23.3%
2147,7,FAY,75,350,0.214285714,"Fayetteville, NC: Fayetteville Regional/Grannis Field",>8.3% and <23.3%
2148,7,FCA,51,403,0.126550868,"Kalispell, MT: Glacier Park International",>8.3% and <23.3%
2149,7,FLG,15,128,0.1171875,"Flagstaff, AZ: Flagstaff Pulliam",>8.3% and <23.3%
2150,7,FLL,2206,8145,0.270841007,"Fort Lauderdale, FL: Fort Lauderdale-Hollywood International",>23.3% and <30.8%
2151,7,FNT,48,337,0.142433234,"Flint, MI: Bishop International",>8.3% and <23.3%
2152,7,FSD,95,526,0.180608365,"Sioux Falls, SD: Joe Foss Field",>8.3% and <23.3%
2153,7,FSM,28,173,0.161849711,"Fort Smith, AR: Fort Smith Regional",>8.3% and <23.3%
2154,7,FWA,82,569,0.144112478,"Fort Wayne, IN: Fort Wayne International",>8.3% and <23.3%
2155,7,GCC,5,69,0.072463768,"Gillette, WY: Gillette Campbell County",>0.8% and <8.3%
2156,7,GCK,6,62,0.096774194,"Garden City, KS: Garden City Regional",>8.3% and <23.3%
2157,7,GEG,134,1094,0.122486289,"Spokane, WA: Spokane International",>8.3% and <23.3%
2158,7,GFK,19,182,0.104395604,"Grand Forks, ND: Grand Forks International",>8.3% and <23.3%
2159,7,GGG,14,80,0.175,"Longview, TX: East Texas Regional",>8.3% and <23.3%
2160,7,GJT,49,376,0.130319149,"Grand Junction, CO: Grand Junction Regional",>8.3% and <23.3%
2161,7,GNV,82,366,0.224043716,"Gainesville, FL: Gainesville Regional",>8.3% and <23.3%
2162,7,GPT,63,387,0.162790698,"Gulfport/Biloxi, MS: Gulfport-Biloxi International",>8.3% and <23.3%
2163,7,GRB,54,340,0.158823529,"Green Bay, WI: Green Bay Austin Straubel International",>8.3% and <23.3%
2164,7,GRI,9,98,0.091836735,"Grand Island, NE: Central Nebraska Regional",>8.3% and <23.3%
2165,7,GRK,45,297,0.151515152,"Killeen, TX: Robert Gray AAF",>8.3% and <23.3%
2166,7,GRR,261,1501,0.173884077,"Grand Rapids, MI: Gerald R. Ford International",>8.3% and <23.3%
2167,7,GSO,243,1177,0.206457094,"Greensboro/High Point, NC: Piedmont Triad International",>8.3% and <23.3%
2168,7,GSP,224,1241,0.180499597,"Greer, SC: Greenville-Spartanburg International",>8.3% and <23.3%
2169,7,GST,1,31,0.032258065,"Gustavus, AK: Gustavus Airport",>0.8% and <8.3%
2170,7,GTF,25,190,0.131578947,"Great Falls, MT: Great Falls International",>8.3% and <23.3%
2171,7,GTR,9,89,0.101123596,"Columbus, MS: Golden Triangle Regional",>8.3% and <23.3%
2172,7,GUC,6,31,0.193548387,"Gunnison, CO: Gunnison-Crested Butte Regional",>8.3% and <23.3%
2173,7,GUM,24,63,0.380952381,"Guam, TT: Guam International",>30.8%
2174,7,HDN,3,32,0.09375,"Hayden, CO: Yampa Valley",>8.3% and <23.3%
2175,7,HGR,7,18,0.388888889,"Hagerstown, MD: Hagerstown Regional-Richard A. Henson Field",>30.8%
2176,7,HHH,7,80,0.0875,"Hilton Head, SC: Hilton Head Airport",>8.3% and <23.3%
2177,7,HIB,0,52,0,"Hibbing, MN: Range Regional",<0.8%
2178,7,HLN,12,183,0.06557377,"Helena, MT: Helena Regional",>0.8% and <8.3%
2179,7,HNL,292,4416,0.066123188,"Honolulu, HI: Daniel K Inouye International",>0.8% and <8.3%
2180,7,HOB,5,58,0.086206897,"Hobbs, NM: Lea County Regional",>8.3% and <23.3%
2181,7,HOU,1680,5125,0.327804878,"Houston, TX: William P Hobby",>30.8%
2182,7,HPN,206,863,0.238702202,"White Plains, NY: Westchester County",>23.3% and <30.8%
2183,7,HRL,42,285,0.147368421,"Harlingen/San Benito, TX: Valley International",>8.3% and <23.3%
2184,7,HSV,113,722,0.156509695,"Huntsville, AL: Huntsville International-Carl T Jones Field",>8.3% and <23.3%
2185,7,HTS,54,161,0.335403727,"Ashland, WV: Tri-State/Milton J. Ferguson Field",>30.8%
2186,7,HVN,11,84,0.130952381,"New Haven, CT: Tweed New Haven",>8.3% and <23.3%
2187,7,HYA,12,31,0.387096774,"Hyannis, MA: Barnstable Municipal-Boardman/Polando Field",>30.8%
2188,7,HYS,23,105,0.219047619,"Hays, KS: Hays Regional",>8.3% and <23.3%
2189,7,IAD,1320,6216,0.212355212,"Washington, DC: Washington Dulles International",>8.3% and <23.3%
2190,7,IAG,20,66,0.303030303,"Niagara Falls, NY: Niagara Falls International",>23.3% and <30.8%
2191,7,IAH,2565,15060,0.170318725,"Houston, TX: George Bush Intercontinental/Houston",>8.3% and <23.3%
2192,7,ICT,146,977,0.149437052,"Wichita, KS: Wichita Dwight D Eisenhower National",>8.3% and <23.3%
2193,7,IDA,27,205,0.131707317,"Idaho Falls, ID: Idaho Falls Regional",>8.3% and <23.3%
2194,7,ILM,115,636,0.18081761,"Wilmington, NC: Wilmington International",>8.3% and <23.3%
2195,7,IMT,6,59,0.101694915,"Iron Mountain/Kingsfd, MI: Ford",>8.3% and <23.3%
2196,7,IND,748,4341,0.172310528,"Indianapolis, IN: Indianapolis International",>8.3% and <23.3%
2197,7,INL,6,61,0.098360656,"International Falls, MN: Falls International Einarson Field",>8.3% and <23.3%
2198,7,ISN,18,122,0.147540984,"Williston, ND: Sloulin Field International",>8.3% and <23.3%
2199,7,ISP,138,540,0.255555556,"Islip, NY: Long Island MacArthur",>23.3% and <30.8%
2200,7,ITH,12,71,0.169014085,"Ithaca/Cortland, NY: Ithaca Tompkins Regional",>8.3% and <23.3%
2201,7,ITO,15,507,0.029585799,"Hilo, HI: Hilo International",>0.8% and <8.3%
2202,7,JAC,103,594,0.173400673,"Jackson, WY: Jackson Hole",>8.3% and <23.3%
2203,7,JAN,122,668,0.182634731,"Jackson/Vicksburg, MS: Jackson Medgar Wiley Evers International",>8.3% and <23.3%
2204,7,JAX,619,2809,0.220363119,"Jacksonville, FL: Jacksonville International",>8.3% and <23.3%
2205,7,JFK,2926,11732,0.249403341,"New York, NY: John F. Kennedy International",>23.3% and <30.8%
2206,7,JLN,19,78,0.243589744,"Joplin, MO: Joplin Regional",>23.3% and <30.8%
2207,7,JMS,17,82,0.207317073,"Jamestown, ND: Jamestown Regional",>8.3% and <23.3%
2208,7,JNU,31,510,0.060784314,"Juneau, AK: Juneau International",>0.8% and <8.3%
2209,7,KOA,85,1393,0.061019383,"Kona, HI: Ellison Onizuka Kona International at Keahole",>0.8% and <8.3%
2210,7,KTN,22,275,0.08,"Ketchikan, AK: Ketchikan International",>0.8% and <8.3%
2211,7,LAN,22,254,0.086614173,"Lansing, MI: Capital Region International",>8.3% and <23.3%
2212,7,LAR,9,52,0.173076923,"Laramie, WY: Laramie Regional",>8.3% and <23.3%
2213,7,LAS,3773,14133,0.266963843,"Las Vegas, NV: McCarran International",>23.3% and <30.8%
2214,7,LAW,17,120,0.141666667,"Lawton/Fort Sill, OK: Lawton-Fort Sill Regional",>8.3% and <23.3%
2215,7,LAX,3650,20033,0.182199371,"Los Angeles, CA: Los Angeles International",>8.3% and <23.3%
2216,7,LBB,94,575,0.163478261,"Lubbock, TX: Lubbock Preston Smith International",>8.3% and <23.3%
2217,7,LBE,14,93,0.150537634,"Latrobe, PA: Arnold Palmer Regional",>8.3% and <23.3%
2218,7,LBF,3,52,0.057692308,"North Platte, NE: North Platte Regional Airport Lee Bird Field",>0.8% and <8.3%
2219,7,LBL,6,52,0.115384615,"Liberal, KS: Liberal Mid-America Regional",>8.3% and <23.3%
2220,7,LCH,22,171,0.128654971,"Lake Charles, LA: Lake Charles Regional",>8.3% and <23.3%
2221,7,LCK,48,139,0.345323741,"Columbus, OH: Rickenbacker International",>30.8%
2222,7,LEX,181,964,0.187759336,"Lexington, KY: Blue Grass",>8.3% and <23.3%
2223,7,LFT,60,343,0.174927114,"Lafayette, LA: Lafayette Regional Paul Fournet Field",>8.3% and <23.3%
2224,7,LGA,3311,14786,0.22392804,"New York, NY: LaGuardia",>8.3% and <23.3%
2225,7,LGB,264,1496,0.176470588,"Long Beach, CA: Long Beach Airport",>8.3% and <23.3%
2226,7,LIH,91,1329,0.068472536,"Lihue, HI: Lihue Airport",>0.8% and <8.3%
2227,7,LIT,236,1206,0.195688226,"Little Rock, AR: Bill and Hillary Clinton Nat Adams Field",>8.3% and <23.3%
2228,7,LNK,15,167,0.089820359,"Lincoln, NE: Lincoln Airport",>8.3% and <23.3%
2229,7,LRD,30,206,0.145631068,"Laredo, TX: Laredo International",>8.3% and <23.3%
2230,7,LSE,21,198,0.106060606,"La Crosse, WI: La Crosse Regional",>8.3% and <23.3%
2231,7,LWB,18,75,0.24,"Lewisburg, WV: Greenbrier Valley",>23.3% and <30.8%
2232,7,LWS,3,60,0.05,"Lewiston, ID: Lewiston Nez Perce County",>0.8% and <8.3%
2233,7,LYH,26,92,0.282608696,"Lynchburg, VA: Lynchburg Regional/Preston Glenn Field",>23.3% and <30.8%
2234,7,MAF,159,762,0.208661417,"Midland/Odessa, TX: Midland International Air and Space Port",>8.3% and <23.3%
2235,7,MBS,24,247,0.097165992,"Saginaw/Bay City/Midland, MI: MBS International",>8.3% and <23.3%
2236,7,MCI,858,5064,0.16943128,"Kansas City, MO: Kansas City International",>8.3% and <23.3%
2237,7,MCO,3843,11991,0.320490368,"Orlando, FL: Orlando International",>30.8%
2238,7,MDT,107,538,0.198884758,"Harrisburg, PA: Harrisburg International",>8.3% and <23.3%
2239,7,MDW,2864,8115,0.352926679,"Chicago, IL: Chicago Midway International",>30.8%
2240,7,MEI,20,92,0.217391304,"Meridian, MS: Key Field",>8.3% and <23.3%
2241,7,MEM,430,2010,0.213930348,"Memphis, TN: Memphis International",>8.3% and <23.3%
2242,7,MFE,92,445,0.206741573,"Mission/McAllen/Edinburg, TX: McAllen Miller International",>8.3% and <23.3%
2243,7,MFR,77,485,0.158762887,"Medford, OR: Rogue Valley International - Medford",>8.3% and <23.3%
2244,7,MGM,72,380,0.189473684,"Montgomery, AL: Montgomery Regional",>8.3% and <23.3%
2245,7,MHK,36,173,0.208092486,"Manhattan/Ft. Riley, KS: Manhattan Regional",>8.3% and <23.3%
2246,7,MHT,134,852,0.157276995,"Manchester, NH: Manchester-Boston Regional",>8.3% and <23.3%
2247,7,MIA,2538,7518,0.337589785,"Miami, FL: Miami International",>30.8%
2248,7,MKE,516,2872,0.179665738,"Milwaukee, WI: General Mitchell International",>8.3% and <23.3%
2249,7,MKG,5,62,0.080645161,"Muskegon, MI: Muskegon County",>0.8% and <8.3%
2250,7,MLB,28,184,0.152173913,"Melbourne, FL: Melbourne International",>8.3% and <23.3%
2251,7,MLI,62,434,0.142857143,"Moline, IL: Quad City International",>8.3% and <23.3%
2252,7,MLU,44,284,0.154929577,"Monroe, LA: Monroe Regional",>8.3% and <23.3%
2253,7,MOB,127,562,0.225978648,"Mobile, AL: Mobile Regional",>8.3% and <23.3%
2254,7,MOT,35,254,0.137795276,"Minot, ND: Minot International",>8.3% and <23.3%
2255,7,MQT,37,137,0.270072993,"Marquette, MI: Sawyer International",>23.3% and <30.8%
2256,7,MRY,64,368,0.173913043,"Monterey, CA: Monterey Regional",>8.3% and <23.3%
2257,7,MSN,175,1160,0.150862069,"Madison, WI: Dane County Regional-Truax Field",>8.3% and <23.3%
2258,7,MSO,72,524,0.13740458,"Missoula, MT: Missoula International",>8.3% and <23.3%
2259,7,MSP,2316,14833,0.15613834,"Minneapolis, MN: Minneapolis-St Paul International",>8.3% and <23.3%
2260,7,MSY,1102,4751,0.231951168,"New Orleans, LA: Louis Armstrong New Orleans International",>8.3% and <23.3%
2261,7,MTJ,28,165,0.16969697,"Montrose/Delta, CO: Montrose Regional",>8.3% and <23.3%
2262,7,MVY,42,175,0.24,"Martha's Vineyard, MA: Martha's Vineyard Airport",>23.3% and <30.8%
2263,7,MYR,294,1448,0.203038674,"Myrtle Beach, SC: Myrtle Beach International",>8.3% and <23.3%
2264,7,OAJ,53,293,0.180887372,"Jacksonville/Camp Lejeune, NC: Albert J Ellis",>8.3% and <23.3%
2265,7,OAK,1011,4811,0.210143421,"Oakland, CA: Metropolitan Oakland International",>8.3% and <23.3%
2266,7,OGD,5,9,0.555555556,"Ogden, UT: Ogden-Hinckley",>30.8%
2267,7,OGG,195,2310,0.084415584,"Kahului, HI: Kahului Airport",>8.3% and <23.3%
2268,7,OGS,3,10,0.3,"Ogdensburg, NY: Ogdensburg International",>23.3% and <30.8%
2269,7,OKC,369,2120,0.174056604,"Oklahoma City, OK: Will Rogers World",>8.3% and <23.3%
2270,7,OMA,351,2231,0.157328552,"Omaha, NE: Eppley Airfield",>8.3% and <23.3%
2271,7,OME,4,61,0.06557377,"Nome, AK: Nome Airport",>0.8% and <8.3%
2272,7,ONT,365,1808,0.201880531,"Ontario, CA: Ontario International",>8.3% and <23.3%
2273,7,ORD,7025,29993,0.234221318,"Chicago, IL: Chicago O'Hare International",>23.3% and <30.8%
2274,7,ORF,427,2037,0.209621993,"Norfolk, VA: Norfolk International",>8.3% and <23.3%
2275,7,ORH,31,93,0.333333333,"Worcester, MA: Worcester Regional",>30.8%
2276,7,OTH,7,40,0.175,"North Bend/Coos Bay, OR: Southwest Oregon Regional",>8.3% and <23.3%
2277,7,OTZ,3,61,0.049180328,"Kotzebue, AK: Ralph Wien Memorial",>0.8% and <8.3%
2278,7,OWB,2,9,0.222222222,"Owensboro, KY: Owensboro Daviess County Regional",>8.3% and <23.3%
2279,7,PAH,6,61,0.098360656,"Paducah, KY: Barkley Regional",>8.3% and <23.3%
2281,7,PBI,502,1787,0.280917739,"West Palm Beach/Palm Beach, FL: Palm Beach International",>23.3% and <30.8%
2282,7,PDX,904,6319,0.143060611,"Portland, OR: Portland International",>8.3% and <23.3%
2283,7,PGD,135,465,0.290322581,"Punta Gorda, FL: Punta Gorda Airport",>23.3% and <30.8%
2284,7,PGV,40,147,0.272108844,"Greenville, NC: Pitt Greenville",>23.3% and <30.8%
2285,7,PHF,73,277,0.263537906,"Newport News/Williamsburg, VA: Newport News/Williamsburg International",>23.3% and <30.8%
2286,7,PHL,2780,10551,0.263482134,"Philadelphia, PA: Philadelphia International",>23.3% and <30.8%
2287,7,PHX,3331,14862,0.22412865,"Phoenix, AZ: Phoenix Sky Harbor International",>8.3% and <23.3%
2288,7,PIA,62,445,0.139325843,"Peoria, IL: General Downing - Peoria International",>8.3% and <23.3%
2289,7,PIB,5,62,0.080645161,"Hattiesburg/Laurel, MS: Hattiesburg-Laurel Regional",>0.8% and <8.3%
2290,7,PIE,184,747,0.246318608,"St. Petersburg, FL: St Pete Clearwater International",>23.3% and <30.8%
2291,7,PIH,3,99,0.03030303,"Pocatello, ID: Pocatello Regional",>0.8% and <8.3%
2292,7,PIT,781,4344,0.179788214,"Pittsburgh, PA: Pittsburgh International",>8.3% and <23.3%
2293,7,PLN,18,133,0.135338346,"Pellston, MI: Pellston Regional Airport of Emmet County",>8.3% and <23.3%
2294,7,PNS,202,1125,0.179555556,"Pensacola, FL: Pensacola International",>8.3% and <23.3%
2296,7,PSC,42,277,0.151624549,"Pasco/Kennewick/Richland, WA: Tri Cities",>8.3% and <23.3%
2297,7,PSE,27,93,0.290322581,"Ponce, PR: Mercedita",>23.3% and <30.8%
2298,7,PSG,3,62,0.048387097,"Petersburg, AK: Petersburg James A Johnson",>0.8% and <8.3%
2299,7,PSM,14,30,0.466666667,"Portsmouth, NH: Portsmouth International at Pease",>30.8%
2300,7,PSP,105,569,0.184534271,"Palm Springs, CA: Palm Springs International",>8.3% and <23.3%
2301,7,PUB,11,78,0.141025641,"Pueblo, CO: Pueblo Memorial",>8.3% and <23.3%
2302,7,PVD,356,1622,0.219482121,"Providence, RI: Theodore Francis Green State",>8.3% and <23.3%
2303,7,PVU,9,49,0.183673469,"Provo, UT: Provo Municipal",>8.3% and <23.3%
2304,7,PWM,308,1344,0.229166667,"Portland, ME: Portland International Jetport",>8.3% and <23.3%
2305,7,RAP,94,522,0.180076628,"Rapid City, SD: Rapid City Regional",>8.3% and <23.3%
2306,7,RDD,13,89,0.146067416,"Redding, CA: Redding Municipal",>8.3% and <23.3%
2307,7,RDM,41,339,0.120943953,"Bend/Redmond, OR: Roberts Field",>8.3% and <23.3%
2308,7,RDU,1295,5325,0.243192488,"Raleigh/Durham, NC: Raleigh-Durham International",>23.3% and <30.8%
2309,7,RFD,17,53,0.320754717,"Rockford, IL: Chicago/Rockford International",>30.8%
2310,7,RHI,6,59,0.101694915,"Rhinelander, WI: Rhinelander/Oneida County",>8.3% and <23.3%
2311,7,RIC,480,1978,0.242669363,"Richmond, VA: Richmond International",>23.3% and <30.8%
2312,7,RKS,9,52,0.173076923,"Rock Springs, WY: Southwest Wyoming Regional",>8.3% and <23.3%
2313,7,RNO,364,1560,0.233333333,"Reno, NV: Reno/Tahoe International",>23.3% and <30.8%
2314,7,ROA,38,211,0.180094787,"Roanoke, VA: Roanoke Blacksburg Regional Woodrum Field",>8.3% and <23.3%
