,Month,Airport,Number of Delays,Total Flights,Percent Delayed,Airport Name,Delay Category
2891,9,IMT,5,55,0.090909091,"Iron Mountain/Kingsfd, MI: Ford",>8.3% and <23.3%
2892,9,IND,549,3790,0.144854881,"Indianapolis, IN: Indianapolis International",>8.3% and <23.3%
2893,9,INL,5,54,0.092592593,"International Falls, MN: Falls International Einarson Field",>8.3% and <23.3%
2894,9,ISN,9,131,0.06870229,"Williston, ND: Sloulin Field International",>0.8% and <8.3%
2895,9,ISP,54,393,0.13740458,"Islip, NY: Long Island MacArthur",>8.3% and <23.3%
2896,9,ITH,7,85,0.082352941,"Ithaca/Cortland, NY: Ithaca Tompkins Regional",>0.8% and <8.3%
2897,9,ITO,19,508,0.037401575,"Hilo, HI: Hilo International",>0.8% and <8.3%
2898,9,JAC,63,392,0.160714286,"Jackson, WY: Jackson Hole",>8.3% and <23.3%
2899,9,JAN,105,635,0.165354331,"Jackson/Vicksburg, MS: Jackson Medgar Wiley Evers International",>8.3% and <23.3%
2900,9,JAX,361,2700,0.133703704,"Jacksonville, FL: Jacksonville International",>8.3% and <23.3%
2901,9,JFK,1645,10711,0.153580431,"New York, NY: John F. Kennedy International",>8.3% and <23.3%
2902,9,JLN,11,59,0.186440678,"Joplin, MO: Joplin Regional",>8.3% and <23.3%
2903,9,JMS,8,81,0.098765432,"Jamestown, ND: Jamestown Regional",>8.3% and <23.3%
2904,9,JNU,24,344,0.069767442,"Juneau, AK: Juneau International",>0.8% and <8.3%
2905,9,KOA,53,1086,0.048802947,"Kona, HI: Ellison Onizuka Kona International at Keahole",>0.8% and <8.3%
2906,9,KTN,25,193,0.129533679,"Ketchikan, AK: Ketchikan International",>8.3% and <23.3%
2907,9,LAN,46,338,0.136094675,"Lansing, MI: Capital Region International",>8.3% and <23.3%
2908,9,LAR,3,50,0.06,"Laramie, WY: Laramie Regional",>0.8% and <8.3%
2909,9,LAS,2025,13318,0.152049857,"Las Vegas, NV: McCarran International",>8.3% and <23.3%
2910,9,LAW,24,110,0.218181818,"Lawton/Fort Sill, OK: Lawton-Fort Sill Regional",>8.3% and <23.3%
2911,9,LAX,2207,17875,0.123468531,"Los Angeles, CA: Los Angeles International",>8.3% and <23.3%
2912,9,LBB,104,502,0.207171315,"Lubbock, TX: Lubbock Preston Smith International",>8.3% and <23.3%
2913,9,LBE,6,81,0.074074074,"Latrobe, PA: Arnold Palmer Regional",>0.8% and <8.3%
2914,9,LBF,2,50,0.04,"North Platte, NE: North Platte Regional Airport Lee Bird Field",>0.8% and <8.3%
2915,9,LBL,2,50,0.04,"Liberal, KS: Liberal Mid-America Regional",>0.8% and <8.3%
2916,9,LCH,23,169,0.136094675,"Lake Charles, LA: Lake Charles Regional",>8.3% and <23.3%
2917,9,LCK,12,68,0.176470588,"Columbus, OH: Rickenbacker International",>8.3% and <23.3%
2918,9,LEX,116,847,0.136953955,"Lexington, KY: Blue Grass",>8.3% and <23.3%
2919,9,LFT,55,371,0.148247978,"Lafayette, LA: Lafayette Regional Paul Fournet Field",>8.3% and <23.3%
2920,9,LGA,2447,13850,0.1766787,"New York, NY: LaGuardia",>8.3% and <23.3%
2921,9,LGB,106,1257,0.084327765,"Long Beach, CA: Long Beach Airport",>8.3% and <23.3%
2922,9,LIH,67,1103,0.060743427,"Lihue, HI: Lihue Airport",>0.8% and <8.3%
2923,9,LIT,139,1043,0.133269415,"Little Rock, AR: Bill and Hillary Clinton Nat Adams Field",>8.3% and <23.3%
2924,9,LNK,13,127,0.102362205,"Lincoln, NE: Lincoln Airport",>8.3% and <23.3%
2925,9,LRD,28,196,0.142857143,"Laredo, TX: Laredo International",>8.3% and <23.3%
2926,9,LSE,19,176,0.107954545,"La Crosse, WI: La Crosse Regional",>8.3% and <23.3%
2927,9,LWB,15,68,0.220588235,"Lewisburg, WV: Greenbrier Valley",>8.3% and <23.3%
2928,9,LWS,3,56,0.053571429,"Lewiston, ID: Lewiston Nez Perce County",>0.8% and <8.3%
2929,9,LYH,31,139,0.223021583,"Lynchburg, VA: Lynchburg Regional/Preston Glenn Field",>8.3% and <23.3%
2930,9,MAF,117,740,0.158108108,"Midland/Odessa, TX: Midland International Air and Space Port",>8.3% and <23.3%
2931,9,MBS,26,243,0.106995885,"Saginaw/Bay City/Midland, MI: MBS International",>8.3% and <23.3%
2932,9,MCI,511,4534,0.112704014,"Kansas City, MO: Kansas City International",>8.3% and <23.3%
2933,9,MCO,1555,9978,0.155842854,"Orlando, FL: Orlando International",>8.3% and <23.3%
2934,9,MDT,74,504,0.146825397,"Harrisburg, PA: Harrisburg International",>8.3% and <23.3%
2935,9,MDW,1545,7171,0.215451123,"Chicago, IL: Chicago Midway International",>8.3% and <23.3%
2936,9,MEI,15,90,0.166666667,"Meridian, MS: Key Field",>8.3% and <23.3%
2937,9,MEM,269,1890,0.142328042,"Memphis, TN: Memphis International",>8.3% and <23.3%
2938,9,MFE,79,388,0.203608247,"Mission/McAllen/Edinburg, TX: McAllen Miller International",>8.3% and <23.3%
2939,9,MFR,47,372,0.126344086,"Medford, OR: Rogue Valley International - Medford",>8.3% and <23.3%
2940,9,MGM,61,347,0.175792507,"Montgomery, AL: Montgomery Regional",>8.3% and <23.3%
2941,9,MHK,25,142,0.176056338,"Manhattan/Ft. Riley, KS: Manhattan Regional",>8.3% and <23.3%
2942,9,MHT,90,744,0.120967742,"Manchester, NH: Manchester-Boston Regional",>8.3% and <23.3%
2943,9,MIA,946,6657,0.142106054,"Miami, FL: Miami International",>8.3% and <23.3%
2944,9,MKE,343,2461,0.139374238,"Milwaukee, WI: General Mitchell International",>8.3% and <23.3%
2945,9,MKG,10,60,0.166666667,"Muskegon, MI: Muskegon County",>8.3% and <23.3%
2946,9,MLB,20,196,0.102040816,"Melbourne, FL: Melbourne International",>8.3% and <23.3%
2947,9,MLI,54,419,0.128878282,"Moline, IL: Quad City International",>8.3% and <23.3%
2948,9,MLU,38,258,0.147286822,"Monroe, LA: Monroe Regional",>8.3% and <23.3%
2949,9,MOB,84,521,0.161228407,"Mobile, AL: Mobile Regional",>8.3% and <23.3%
2950,9,MOT,19,205,0.092682927,"Minot, ND: Minot International",>8.3% and <23.3%
2951,9,MQT,15,120,0.125,"Marquette, MI: Sawyer International",>8.3% and <23.3%
2952,9,MRY,57,287,0.198606272,"Monterey, CA: Monterey Regional",>8.3% and <23.3%
2953,9,MSN,145,1233,0.117599351,"Madison, WI: Dane County Regional-Truax Field",>8.3% and <23.3%
2954,9,MSO,29,338,0.085798817,"Missoula, MT: Missoula International",>8.3% and <23.3%
2955,9,MSP,1653,13349,0.1238295,"Minneapolis, MN: Minneapolis-St Paul International",>8.3% and <23.3%
2956,9,MSY,653,4306,0.151648862,"New Orleans, LA: Louis Armstrong New Orleans International",>8.3% and <23.3%
2957,9,MTJ,11,75,0.146666667,"Montrose/Delta, CO: Montrose Regional",>8.3% and <23.3%
2958,9,MVY,5,43,0.11627907,"Martha's Vineyard, MA: Martha's Vineyard Airport",>8.3% and <23.3%
2959,9,MYR,128,1124,0.113879004,"Myrtle Beach, SC: Myrtle Beach International",>8.3% and <23.3%
2960,9,OAJ,30,250,0.12,"Jacksonville/Camp Lejeune, NC: Albert J Ellis",>8.3% and <23.3%
2961,9,OAK,661,4357,0.151709892,"Oakland, CA: Metropolitan Oakland International",>8.3% and <23.3%
2962,9,OGD,5,8,0.625,"Ogden, UT: Ogden-Hinckley",>30.8%
2963,9,OGG,160,2024,0.079051383,"Kahului, HI: Kahului Airport",>0.8% and <8.3%
2964,9,OKC,269,1959,0.137314957,"Oklahoma City, OK: Will Rogers World",>8.3% and <23.3%
2965,9,OMA,293,2168,0.135147601,"Omaha, NE: Eppley Airfield",>8.3% and <23.3%
2966,9,OME,1,60,0.016666667,"Nome, AK: Nome Airport",>0.8% and <8.3%
2967,9,ONT,208,1769,0.117580554,"Ontario, CA: Ontario International",>8.3% and <23.3%
2968,9,ORD,4836,28257,0.171143433,"Chicago, IL: Chicago O'Hare International",>8.3% and <23.3%
2969,9,ORF,341,2101,0.162303665,"Norfolk, VA: Norfolk International",>8.3% and <23.3%
2970,9,ORH,24,90,0.266666667,"Worcester, MA: Worcester Regional",>23.3% and <30.8%
2971,9,OTH,9,39,0.230769231,"North Bend/Coos Bay, OR: Southwest Oregon Regional",>8.3% and <23.3%
2972,9,OTZ,6,60,0.1,"Kotzebue, AK: Ralph Wien Memorial",>8.3% and <23.3%
2973,9,OWB,2,9,0.222222222,"Owensboro, KY: Owensboro Daviess County Regional",>8.3% and <23.3%
2974,9,PAH,3,60,0.05,"Paducah, KY: Barkley Regional",>0.8% and <8.3%
2976,9,PBI,254,1516,0.167546174,"West Palm Beach/Palm Beach, FL: Palm Beach International",>8.3% and <23.3%
2977,9,PDX,545,5246,0.103888677,"Portland, OR: Portland International",>8.3% and <23.3%
2978,9,PGD,27,261,0.103448276,"Punta Gorda, FL: Punta Gorda Airport",>8.3% and <23.3%
2979,9,PGV,17,114,0.149122807,"Greenville, NC: Pitt Greenville",>8.3% and <23.3%
2980,9,PHF,35,218,0.160550459,"Newport News/Williamsburg, VA: Newport News/Williamsburg International",>8.3% and <23.3%
2981,9,PHL,1760,9508,0.185107278,"Philadelphia, PA: Philadelphia International",>8.3% and <23.3%
2982,9,PHX,2124,13126,0.161816243,"Phoenix, AZ: Phoenix Sky Harbor International",>8.3% and <23.3%
2983,9,PIA,47,401,0.117206983,"Peoria, IL: General Downing - Peoria International",>8.3% and <23.3%
2984,9,PIB,4,60,0.066666667,"Hattiesburg/Laurel, MS: Hattiesburg-Laurel Regional",>0.8% and <8.3%
2985,9,PIE,68,417,0.163069544,"St. Petersburg, FL: St Pete Clearwater International",>8.3% and <23.3%
2986,9,PIH,7,119,0.058823529,"Pocatello, ID: Pocatello Regional",>0.8% and <8.3%
2987,9,PIT,547,4022,0.136001989,"Pittsburgh, PA: Pittsburgh International",>8.3% and <23.3%
2988,9,PLN,12,81,0.148148148,"Pellston, MI: Pellston Regional Airport of Emmet County",>8.3% and <23.3%
2989,9,PNS,114,970,0.117525773,"Pensacola, FL: Pensacola International",>8.3% and <23.3%
2991,9,PRC,10,55,0.181818182,"Prescott, AZ: Prescott Regional Ernest A Love Field",>8.3% and <23.3%
2992,9,PSC,20,178,0.112359551,"Pasco/Kennewick/Richland, WA: Tri Cities",>8.3% and <23.3%
2993,9,PSE,5,55,0.090909091,"Ponce, PR: Mercedita",>8.3% and <23.3%
2994,9,PSG,6,60,0.1,"Petersburg, AK: Petersburg James A Johnson",>8.3% and <23.3%
2995,9,PSM,4,11,0.363636364,"Portsmouth, NH: Portsmouth International at Pease",>30.8%
2996,9,PSP,49,620,0.079032258,"Palm Springs, CA: Palm Springs International",>0.8% and <8.3%
2997,9,PUB,6,75,0.08,"Pueblo, CO: Pueblo Memorial",>0.8% and <8.3%
2998,9,PVD,213,1445,0.147404844,"Providence, RI: Theodore Francis Green State",>8.3% and <23.3%
2999,9,PVU,6,39,0.153846154,"Provo, UT: Provo Municipal",>8.3% and <23.3%
3000,9,PWM,173,1170,0.147863248,"Portland, ME: Portland International Jetport",>8.3% and <23.3%
3001,9,RAP,48,387,0.124031008,"Rapid City, SD: Rapid City Regional",>8.3% and <23.3%
3002,9,RDD,19,84,0.226190476,"Redding, CA: Redding Municipal",>8.3% and <23.3%
3003,9,RDM,46,383,0.120104439,"Bend/Redmond, OR: Roberts Field",>8.3% and <23.3%
3004,9,RDU,878,5026,0.174691604,"Raleigh/Durham, NC: Raleigh-Durham International",>8.3% and <23.3%
3005,9,RFD,6,43,0.139534884,"Rockford, IL: Chicago/Rockford International",>8.3% and <23.3%
3006,9,RHI,9,60,0.15,"Rhinelander, WI: Rhinelander/Oneida County",>8.3% and <23.3%
3007,9,RIC,341,1945,0.175321337,"Richmond, VA: Richmond International",>8.3% and <23.3%
3008,9,RKS,2,55,0.036363636,"Rock Springs, WY: Southwest Wyoming Regional",>0.8% and <8.3%
3009,9,RNO,172,1566,0.109833972,"Reno, NV: Reno/Tahoe International",>8.3% and <23.3%
3010,9,ROA,40,209,0.19138756,"Roanoke, VA: Roanoke Blacksburg Regional Woodrum Field",>8.3% and <23.3%
3011,9,ROC,183,1232,0.148538961,"Rochester, NY: Greater Rochester International",>8.3% and <23.3%
3012,9,ROW,19,115,0.165217391,"Roswell, NM: Roswell International Air Center",>8.3% and <23.3%
3013,9,RST,39,324,0.12037037,"Rochester, MN: Rochester International",>8.3% and <23.3%
3014,9,RSW,223,1540,0.144805195,"Fort Myers, FL: Southwest Florida International",>8.3% and <23.3%
3015,9,SAF,15,109,0.137614679,"Santa Fe, NM: Santa Fe Municipal",>8.3% and <23.3%
3016,9,SAN,1023,7440,0.1375,"San Diego, CA: San Diego International",>8.3% and <23.3%
3017,9,SAT,516,3334,0.154769046,"San Antonio, TX: San Antonio International",>8.3% and <23.3%
3018,9,SAV,166,1264,0.131329114,"Savannah, GA: Savannah/Hilton Head International",>8.3% and <23.3%
3019,9,SBA,69,591,0.116751269,"Santa Barbara, CA: Santa Barbara Municipal",>8.3% and <23.3%
3020,9,SBN,105,618,0.169902913,"South Bend, IN: South Bend International",>8.3% and <23.3%
3021,9,SBP,56,398,0.140703518,"San Luis Obispo, CA: San Luis County Regional",>8.3% and <23.3%
3022,9,SCC,4,80,0.05,"Deadhorse, AK: Deadhorse Airport",>0.8% and <8.3%
3023,9,SCE,19,141,0.134751773,"State College, PA: University Park",>8.3% and <23.3%
3024,9,SCK,19,63,0.301587302,"Stockton, CA: Stockton Metropolitan",>23.3% and <30.8%
3025,9,SDF,288,2005,0.143640898,"Louisville, KY: Louisville Muhammad Ali International",>8.3% and <23.3%
3026,9,SEA,1920,11872,0.161725067,"Seattle, WA: Seattle/Tacoma International",>8.3% and <23.3%
3027,9,SFB,61,473,0.128964059,"Sanford, FL: Orlando Sanford International",>8.3% and <23.3%
3028,9,SFO,2025,14332,0.141292213,"San Francisco, CA: San Francisco International",>8.3% and <23.3%
3029,9,SGF,118,724,0.162983425,"Springfield, MO: Springfield-Branson National",>8.3% and <23.3%
3030,9,SGU,5,269,0.018587361,"St. George, UT: St George Regional",>0.8% and <8.3%
3031,9,SHD,13,80,0.1625,"Staunton, VA: Shenandoah Valley Regional",>8.3% and <23.3%
3032,9,SHV,87,565,0.153982301,"Shreveport, LA: Shreveport Regional",>8.3% and <23.3%
3033,9,SIT,8,106,0.075471698,"Sitka, AK: Sitka Rocky Gutierrez",>0.8% and <8.3%
3034,9,SJC,603,4682,0.128791115,"San Jose, CA: Norman Y. Mineta San Jose International",>8.3% and <23.3%
3035,9,SJT,22,110,0.2,"San Angelo, TX: San Angelo Regional/Mathis Field",>8.3% and <23.3%
3036,9,SJU,275,1572,0.174936387,"San Juan, PR: Luis Munoz Marin International",>8.3% and <23.3%
3037,9,SLC,971,9289,0.104532242,"Salt Lake City, UT: Salt Lake City International",>8.3% and <23.3%
3038,9,SLN,13,75,0.173333333,"Salina, KS: Salina Regional",>8.3% and <23.3%
3039,9,SMF,413,3931,0.105062325,"Sacramento, CA: Sacramento International",>8.3% and <23.3%
3040,9,SMX,4,13,0.307692308,"Santa Maria, CA: Santa Maria Public/Capt. G. Allan Hancock Field",>23.3% and <30.8%
3041,9,SNA,427,3459,0.123446083,"Santa Ana, CA: John Wayne Airport-Orange County",>8.3% and <23.3%
3042,9,SPI,22,148,0.148648649,"Springfield, IL: Abraham Lincoln Capital",>8.3% and <23.3%
3043,9,SPN,1,38,0.026315789,"Saipan, TT: Francisco C. Ada Saipan International",>0.8% and <8.3%
3044,9,SPS,7,80,0.0875,"Wichita Falls, TX: Sheppard AFB/Wichita Falls Municipal",>8.3% and <23.3%
3045,9,SRQ,53,467,0.113490364,"Sarasota/Bradenton, FL: Sarasota/Bradenton International",>8.3% and <23.3%
3046,9,STC,1,5,0.2,"St. Cloud, MN: St. Cloud Regional",>8.3% and <23.3%
3047,9,STL,848,5419,0.156486437,"St. Louis, MO: St Louis Lambert International",>8.3% and <23.3%
3048,9,STS,17,144,0.118055556,"Santa Rosa, CA: Charles M. Schulz - Sonoma County",>8.3% and <23.3%
3049,9,STT,25,193,0.129533679,"Charlotte Amalie, VI: Cyril E King",>8.3% and <23.3%
3050,9,STX,6,60,0.1,"Christiansted, VI: Henry E. Rohlsen",>8.3% and <23.3%
3051,9,SUN,10,87,0.114942529,"Sun Valley/Hailey/Ketchum, ID: Friedman Memorial",>8.3% and <23.3%
3052,9,SUX,19,110,0.172727273,"Sioux City, IA: Sioux Gateway Brig Gen Bud Day Field",>8.3% and <23.3%
3053,9,SWF,40,149,0.268456376,"Newburgh/Poughkeepsie, NY: New York Stewart International",>23.3% and <30.8%
3054,9,SWO,9,73,0.123287671,"Stillwater, OK: Stillwater Regional",>8.3% and <23.3%
3055,9,SYR,154,1135,0.135682819,"Syracuse, NY: Syracuse Hancock International",>8.3% and <23.3%
3056,9,TLH,59,529,0.111531191,"Tallahassee, FL: Tallahassee International",>8.3% and <23.3%
3057,9,TOL,5,134,0.037313433,"Toledo, OH: Toledo Express",>0.8% and <8.3%
3058,9,TPA,896,5278,0.169761273,"Tampa, FL: Tampa International",>8.3% and <23.3%
3059,9,TRI,24,175,0.137142857,"Bristol/Johnson City/Kingsport, TN: Tri Cities",>8.3% and <23.3%
3060,9,TTN,82,240,0.341666667,"Trenton, NJ: Trenton Mercer",>30.8%
3061,9,TUL,188,1386,0.135642136,"Tulsa, OK: Tulsa International",>8.3% and <23.3%
3062,9,TUS,153,1352,0.11316568,"Tucson, AZ: Tucson International",>8.3% and <23.3%
3063,9,TVC,45,416,0.108173077,"Traverse City, MI: Cherry Capital",>8.3% and <23.3%
3064,9,TWF,0,85,0,"Twin Falls, ID: Joslin Field - Magic Valley Regional",<0.8%
3065,9,TXK,15,106,0.141509434,"Texarkana, AR: Texarkana Regional-Webb Field",>8.3% and <23.3%
3066,9,TYR,21,129,0.162790698,"Tyler, TX: Tyler Pounds Regional",>8.3% and <23.3%
3067,9,TYS,187,1269,0.147360126,"Knoxville, TN: McGhee Tyson",>8.3% and <23.3%
3068,9,UIN,13,75,0.173333333,"Quincy, IL: Quincy Regional-Baldwin Field",>8.3% and <23.3%
3069,9,USA,11,58,0.189655172,"CONCORD, NC: Concord Padgett Regional",>8.3% and <23.3%
3070,9,VEL,2,50,0.04,"Vernal, UT: Vernal Regional",>0.8% and <8.3%
3071,9,VLD,9,84,0.107142857,"Valdosta, GA: Valdosta Regional",>8.3% and <23.3%
3072,9,VPS,94,662,0.141993958,"Valparaiso, FL: Eglin AFB Destin Fort Walton Beach",>8.3% and <23.3%
3073,9,WRG,5,60,0.083333333,"Wrangell, AK: Wrangell Airport",>8.3% and <23.3%
3074,9,WYS,1,52,0.019230769,"West Yellowstone, MT: Yellowstone",>0.8% and <8.3%
3075,9,XNA,133,1004,0.13247012,"Fayetteville, AR: Northwest Arkansas Regional",>8.3% and <23.3%
3076,9,YAK,3,60,0.05,"Yakutat, AK: Yakutat Airport",>0.8% and <8.3%
3077,9,YUM,2,96,0.020833333,"Yuma, AZ: Yuma MCAS/Yuma International",>0.8% and <8.3%
3078,10,ABE,37,338,0.109467456,"Allentown/Bethlehem/Easton, PA: Lehigh Valley International",>8.3% and <23.3%
3079,10,ABI,30,177,0.169491525,"Abilene, TX: Abilene Regional",>8.3% and <23.3%
3080,10,ABQ,371,2138,0.17352666,"Albuquerque, NM: Albuquerque International Sunport",>8.3% and <23.3%
3081,10,ABR,8,70,0.114285714,"Aberdeen, SD: Aberdeen Regional",>8.3% and <23.3%
3082,10,ABY,13,88,0.147727273,"Albany, GA: Southwest Georgia Regional",>8.3% and <23.3%
3083,10,ACK,8,34,0.235294118,"Nantucket, MA: Nantucket Memorial",>23.3% and <30.8%
3084,10,ACT,29,142,0.204225352,"Waco, TX: Waco Regional",>8.3% and <23.3%
3085,10,ACV,22,148,0.148648649,"Arcata/Eureka, CA: California Redwood Coast Humboldt County",>8.3% and <23.3%
3086,10,ACY,11,241,0.045643154,"Atlantic City, NJ: Atlantic City International",>0.8% and <8.3%
3087,10,ADK,5,9,0.555555556,"Adak Island, AK: Adak",>30.8%
3088,10,ADQ,7,53,0.132075472,"Kodiak, AK: Kodiak Airport",>8.3% and <23.3%
3089,10,AEX,35,295,0.118644068,"Alexandria, LA: Alexandria International",>8.3% and <23.3%
3090,10,AGS,41,387,0.105943152,"Augusta, GA: Augusta Regional at Bush Field",>8.3% and <23.3%
3091,10,ALB,124,1058,0.117202268,"Albany, NY: Albany International",>8.3% and <23.3%
3092,10,ALO,5,58,0.086206897,"Waterloo, IA: Waterloo Regional",>8.3% and <23.3%
3093,10,AMA,68,468,0.145299145,"Amarillo, TX: Rick Husband Amarillo International",>8.3% and <23.3%
3094,10,ANC,108,1357,0.079587325,"Anchorage, AK: Ted Stevens Anchorage International",>0.8% and <8.3%
3095,10,APN,5,53,0.094339623,"Alpena, MI: Alpena County Regional",>8.3% and <23.3%
3096,10,ASE,56,285,0.196491228,"Aspen, CO: Aspen Pitkin County Sardy Field",>8.3% and <23.3%
3097,10,ATL,3895,33140,0.117531684,"Atlanta, GA: Hartsfield-Jackson Atlanta International",>8.3% and <23.3%
3098,10,ATW,27,332,0.081325301,"Appleton, WI: Appleton International",>0.8% and <8.3%
3099,10,AUS,1009,5553,0.181703584,"Austin, TX: Austin - Bergstrom International",>8.3% and <23.3%
3100,10,AVL,106,763,0.138925295,"Asheville, NC: Asheville Regional",>8.3% and <23.3%
3101,10,AVP,31,318,0.097484277,"Scranton/Wilkes-Barre, PA: Wilkes Barre Scranton International",>8.3% and <23.3%
3102,10,AZA,78,422,0.184834123,"Phoenix, AZ: Phoenix - Mesa Gateway",>8.3% and <23.3%
3103,10,AZO,30,242,0.123966942,"Kalamazoo, MI: Kalamazoo/Battle Creek International",>8.3% and <23.3%
3104,10,BDL,242,2435,0.099383984,"Hartford, CT: Bradley International",>8.3% and <23.3%
3105,10,BET,7,72,0.097222222,"Bethel, AK: Bethel Airport",>8.3% and <23.3%
3106,10,BFF,3,54,0.055555556,"Scottsbluff, NE: Western Neb. Regional/William B. Heilig Field",>0.8% and <8.3%
3107,10,BFL,32,207,0.154589372,"Bakersfield, CA: Meadows Field",>8.3% and <23.3%
3108,10,BGM,12,89,0.134831461,"Binghamton, NY: Greater Binghamton/Edwin A. Link Field",>8.3% and <23.3%
3109,10,BGR,66,411,0.160583942,"Bangor, ME: Bangor International",>8.3% and <23.3%
3110,10,BHM,201,1668,0.120503597,"Birmingham, AL: Birmingham-Shuttlesworth International",>8.3% and <23.3%
3111,10,BIL,29,308,0.094155844,"Billings, MT: Billings Logan International",>8.3% and <23.3%
3112,10,BIS,42,296,0.141891892,"Bismarck/Mandan, ND: Bismarck Municipal",>8.3% and <23.3%
3113,10,BJI,5,62,0.080645161,"Bemidji, MN: Bemidji Regional",>0.8% and <8.3%
3114,10,BKG,1,14,0.071428571,"Branson, MO: Branson Airport",>0.8% and <8.3%
3115,10,BLI,21,130,0.161538462,"Bellingham, WA: Bellingham International",>8.3% and <23.3%
3116,10,BLV,13,65,0.2,"Belleville, IL: Scott AFB/MidAmerica",>8.3% and <23.3%
3117,10,BMI,53,289,0.183391003,"Bloomington/Normal, IL: Central Il Regional Airport at Bloomington",>8.3% and <23.3%
3118,10,BNA,1086,6829,0.159027676,"Nashville, TN: Nashville International",>8.3% and <23.3%
3119,10,BOI,187,1618,0.115574784,"Boise, ID: Boise Air Terminal",>8.3% and <23.3%
3120,10,BOS,2483,13018,0.190735904,"Boston, MA: Logan International",>8.3% and <23.3%
3121,10,BPT,9,79,0.113924051,"Beaumont/Port Arthur, TX: Jack Brooks Regional",>8.3% and <23.3%
3122,10,BQK,5,88,0.056818182,"Brunswick, GA: Brunswick Golden Isles",>0.8% and <8.3%
3123,10,BQN,28,160,0.175,"Aguadilla, PR: Rafael Hernandez",>8.3% and <23.3%
3124,10,BRD,3,54,0.055555556,"Brainerd, MN: Brainerd Lakes Regional",>0.8% and <8.3%
3125,10,BRO,23,248,0.092741935,"Brownsville, TX: Brownsville South Padre Island International",>8.3% and <23.3%
3126,10,BRW,3,62,0.048387097,"Barrow, AK: Wiley Post/Will Rogers Memorial",>0.8% and <8.3%
3127,10,BTM,3,58,0.051724138,"Butte, MT: Bert Mooney",>0.8% and <8.3%
3128,10,BTR,146,652,0.22392638,"Baton Rouge, LA: Baton Rouge Metropolitan/Ryan Field",>8.3% and <23.3%
3129,10,BTV,141,886,0.159142212,"Burlington, VT: Burlington International",>8.3% and <23.3%
3130,10,BUF,255,2368,0.107685811,"Buffalo, NY: Buffalo Niagara International",>8.3% and <23.3%
3131,10,BUR,374,2242,0.166815343,"Burbank, CA: Bob Hope",>8.3% and <23.3%
3132,10,BWI,1127,8830,0.127633069,"Baltimore, MD: Baltimore/Washington International Thurgood Marshall",>8.3% and <23.3%
3133,10,BZN,50,395,0.126582278,"Bozeman, MT: Bozeman Yellowstone International",>8.3% and <23.3%
3134,10,CAE,68,635,0.107086614,"Columbia, SC: Columbia Metropolitan",>8.3% and <23.3%
3135,10,CAK,86,681,0.126284875,"Akron, OH: Akron-Canton Regional",>8.3% and <23.3%
3136,10,CDC,6,53,0.113207547,"Cedar City, UT: Cedar City Regional",>8.3% and <23.3%
3137,10,CDV,5,62,0.080645161,"Cordova, AK: Merle K Mudhole Smith",>0.8% and <8.3%
3138,10,CGI,5,54,0.092592593,"Cape Girardeau, MO: Cape Girardeau Regional",>8.3% and <23.3%
3139,10,CHA,84,721,0.116504854,"Chattanooga, TN: Lovell Field",>8.3% and <23.3%
3140,10,CHO,72,478,0.150627615,"Charlottesville, VA: Charlottesville Albemarle",>8.3% and <23.3%
3141,10,CHS,270,2099,0.128632682,"Charleston, SC: Charleston AFB/International",>8.3% and <23.3%
3142,10,CID,108,827,0.130592503,"Cedar Rapids/Iowa City, IA: The Eastern Iowa",>8.3% and <23.3%
3143,10,CIU,4,58,0.068965517,"Sault Ste. Marie, MI: Chippewa County International",>0.8% and <8.3%
3144,10,CKB,10,66,0.151515152,"Clarksburg/Fairmont, WV: North Central West Virginia",>8.3% and <23.3%
3145,10,CLE,550,4132,0.133107454,"Cleveland, OH: Cleveland-Hopkins International",>8.3% and <23.3%
3146,10,CLL,17,202,0.084158416,"College Station/Bryan, TX: Easterwood Field",>8.3% and <23.3%
3147,10,CLT,2926,20213,0.144758324,"Charlotte, NC: Charlotte Douglas International",>8.3% and <23.3%
3148,10,CMH,518,3997,0.129597198,"Columbus, OH: John Glenn Columbus International",>8.3% and <23.3%
3149,10,CMI,35,204,0.171568627,"Champaign/Urbana, IL: University of Illinois/Willard",>8.3% and <23.3%
3150,10,CMX,11,62,0.177419355,"Hancock/Houghton, MI: Houghton County Memorial",>8.3% and <23.3%
3151,10,CNY,6,52,0.115384615,"Moab, UT: Canyonlands Field",>8.3% and <23.3%
3152,10,COD,11,62,0.177419355,"Cody, WY: Yellowstone Regional",>8.3% and <23.3%
3153,10,COS,145,849,0.170789164,"Colorado Springs, CO: City of Colorado Springs Municipal",>8.3% and <23.3%
3154,10,COU,40,206,0.194174757,"Columbia, MO: Columbia Regional",>8.3% and <23.3%
3155,10,CPR,0,67,0,"Casper, WY: Casper/Natrona County International",<0.8%
3156,10,CRP,80,512,0.15625,"Corpus Christi, TX: Corpus Christi International",>8.3% and <23.3%
3157,10,CRW,63,400,0.1575,"Charleston/Dunbar, WV: Yeager",>8.3% and <23.3%
3158,10,CSG,23,116,0.198275862,"Columbus, GA: Columbus Airport",>8.3% and <23.3%
3159,10,CVG,584,4341,0.134531214,"Cincinnati, OH: Cincinnati/Northern Kentucky International",>8.3% and <23.3%
3160,10,CWA,28,226,0.123893805,"Mosinee, WI: Central Wisconsin",>8.3% and <23.3%
3161,10,DAB,40,297,0.134680135,"Daytona Beach, FL: Daytona Beach International",>8.3% and <23.3%
3162,10,DAL,1571,6060,0.259240924,"Dallas, TX: Dallas Love Field",>23.3% and <30.8%
3163,10,DAY,175,1205,0.145228216,"Dayton, OH: James M Cox/Dayton International",>8.3% and <23.3%
3164,10,DBQ,11,88,0.125,"Dubuque, IA: Dubuque Regional",>8.3% and <23.3%
3165,10,DCA,1702,11827,0.143908007,"Washington, DC: Ronald Reagan Washington National",>8.3% and <23.3%
3166,10,DEN,3680,20613,0.178528113,"Denver, CO: Denver International",>8.3% and <23.3%
3167,10,DFW,5703,23529,0.242381742,"Dallas/Fort Worth, TX: Dallas/Fort Worth International",>23.3% and <30.8%
3168,10,DHN,8,116,0.068965517,"Dothan, AL: Dothan Regional",>0.8% and <8.3%
3169,10,DLH,37,263,0.140684411,"Duluth, MN: Duluth International",>8.3% and <23.3%
3170,10,DRO,41,291,0.140893471,"Durango, CO: Durango La Plata County",>8.3% and <23.3%
3171,10,DSM,180,1303,0.138142748,"Des Moines, IA: Des Moines International",>8.3% and <23.3%
3172,10,DTW,1395,13396,0.104135563,"Detroit, MI: Detroit Metro Wayne County",>8.3% and <23.3%
3173,10,DVL,8,53,0.150943396,"Devils Lake, ND: Devils Lake Regional",>8.3% and <23.3%
3174,10,EAR,1,54,0.018518519,"Kearney, NE: Kearney Regional",>0.8% and <8.3%
3175,10,EAU,8,62,0.129032258,"Eau Claire, WI: Chippewa Valley Regional",>8.3% and <23.3%
3176,10,ECP,105,513,0.204678363,"Panama City, FL: Northwest Florida Beaches International",>8.3% and <23.3%
3177,10,EGE,11,89,0.123595506,"Eagle, CO: Eagle County Regional",>8.3% and <23.3%
3178,10,EKO,3,58,0.051724138,"Elko, NV: Elko Regional",>0.8% and <8.3%
